{"finished_at":"2026-09-12T10:02:01Z","findings":[{"confidence":0.99,"file":"services/payments/crypto/vault.py","line":7,"metadata":{"algorithm":"AES","mode":"ECB"},"rule_id":"AES-ECB","severity":"critical","snippet":"AES.new(k, AES.MODE_ECB)","title":"AES-ECB in vault"}],"scan_id":"sim-p1p2-single-001","schema_version":"1.0","started_at":"2026-09-12T10:02:00Z","stats":{"files_scanned":1,"findings_count":1},"target":"services/payments/crypto/vault.py","tool_versions":{"ecdat":"0.1.0"}}