{"finished_at":"2026-09-12T10:00:09Z","findings":[{"confidence":0.99,"file":"services/payments/crypto/vault_encryption_service.py","line":214,"metadata":{"algorithm":"AES","mode":"ECB","rerank":"vault","source":"simulated-p1"},"rule_id":"AES-ECB","severity":"critical","snippet":"cipher = AES.new(k, AES.MODE_ECB)","title":"AES-ECB block mode leaks plaintext structure in vault data-encryption path (migrate to AES-GCM with unique nonces)"},{"confidence":0.95,"file":"services/payments/api/auth_tokens.py","line":88,"metadata":{"algorithm":"RSA","key_size":"1024","usage":"jwt-sign"},"rule_id":"RSA-1024","severity":"high","snippet":"jwt.encode(payload, key_1024, algorithm=\"RS256\")","title":"1024-bit RSA JWT signing key (RS256-1024) below 2048-bit minimum"},{"confidence":0.9,"file":"services/billing/legacy/invoice_signer.py","line":41,"metadata":{"algorithm":"RSA","key_size":"1024","usage":"invoice-sign"},"rule_id":"RSA-1024","severity":"high","snippet":"rsa.generate_private_key(key_size=1024)","title":"1024-bit RSA invoice signing key in legacy billing service"},{"confidence":0.9,"file":"services/auth/password_store.py","line":132,"metadata":{"algorithm":"MD5","replacement":"SHA-256","status":"broken"},"rule_id":"MD5-USAGE","severity":"medium","snippet":"hashlib.md5(pw.encode()).hexdigest()","title":"MD5 password hashing must migrate to SHA-256+ with salt"},{"confidence":0.8,"file":"services/edge/legacy_gateway/conf/very/long/nested/directory/legacy_tls_listener.conf","line":17,"metadata":{"protocol":"TLS 1.0"},"rule_id":"TLS-1.0","severity":"low","snippet":"ssl_protocols TLSv1 TLSv1.2;","title":"Legacy TLS 1.0 listener still enabled on legacy gateway"},{"confidence":0.85,"file":"infra/terraform/kms/keys.tf","line":23,"metadata":{"managed_by":"aws-kms","rotation":"manual"},"rule_id":"KMS-NO-ROTATION","severity":"medium","snippet":"enable_key_rotation = false","title":"KMS data key has automatic rotation disabled"},{"confidence":0.88,"file":"infra/terraform/acm/legacy_cert.tf","line":9,"metadata":{"expiry":"2024-11-01","issuer":"acm-private-ca"},"rule_id":"ACM-EXPIRY","severity":"high","snippet":"certificate_arn = aws_acm_certificate.legacy.arn","title":"Legacy ACM certificate past expiry still attached to billing listener"},{"confidence":0.75,"file":"infra/terraform/elb/classic_listener.tf","line":31,"metadata":{"service":"elb"},"rule_id":"ELB-TLS-OLD","severity":"low","snippet":"ssl_security_policy = \"ELBSecurityPolicy-2015-05\"","title":"Classic ELB listener uses outdated TLS security policy"},{"confidence":0.6,"file":"services/archive/compat.py","line":5,"metadata":{"algorithm":"DES","status":"legacy"},"rule_id":"DES-USAGE","severity":"info","snippet":"DES.new(compat_key, DES.MODE_ECB)","title":"DES fallback retained for legacy archive compatibility (informational)"}],"scan_id":"sim-p1p2-001","schema_version":"1.0","started_at":"2026-09-12T10:00:00Z","stats":{"files_scanned":9,"findings_count":9},"target":"services/payments/","tool_versions":{"ecdat":"0.1.0"}}