{"finished_at":"2026-09-12T10:01:02Z","findings":[{"file":"services/payments/api/auth_tokens.py","line":88,"rule_id":"RSA-1024","severity":"high","title":"1024-bit RSA JWT signing key without optional evidence fields"},{"file":"services/auth/password_store.py","line":132,"rule_id":"MD5-USAGE","severity":"medium","snippet":"hashlib.md5(pw.encode()).hexdigest()","title":"MD5 password hashing (snippet only, no confidence)"},{"confidence":0.7,"file":"services/edge/pilot.py","line":3,"metadata":{"pilot":"true"},"rule_id":"TLS-1.0","severity":"low","snippet":"ssl.PROTOCOL_TLSv1","title":"Old TLS in pilot service"}],"scan_id":"sim-p1p2-partial-001","schema_version":"1.0","started_at":"2026-09-12T10:01:00Z","stats":{"files_scanned":3,"findings_count":3},"target":"services/partial/","tool_versions":{"ecdat":"0.1.0"}}